ref_no,part_number,description,side,year_range,fitting_vehicle_options,engine,require_quantity,package_quantity,replaced_by,replaces,notes,status,msrp,sale_price,item_dimensions,item_weight,detail_url
1,4763776AB,PUMP Water,,,,,,,,,,discontinued,,,,,
3,4763790AB,GASKET Water Pump,,2000-2002,"GTS Coupe, GTS-L Coupe, RT/10 Convertible",10 Cyl 8.0L,,,,,,discontinued,,,12.2 x 10.4 x 0.3 inches,0.50 Pounds,/parts/mopar-gasket-water-pump~4763790ab.html
4,53010221,PULLEY Water Pump,,1997-2002,"GTS Coupe, GTS-L Coupe, RT/10 Convertible",10 Cyl 8.0L,,,,,,discontinued,,,6.3 x 6.4 x 2.2 inches,1.80 Pounds,/parts/mopar-pulley-water-pump~53010221.html
5,6034530,SCREW Hex Head .312-18x.75,,1992-2006,"COMP. Coupe, GTS Coupe, GTS-L Coupe, RT/10 Convertible, SRT-10 Convertible, SRT-10 Coupe","10 Cyl 8.0L, 10 Cyl 8.3L",4,1,,,,available,5.33,4.19,1.0 x 0.8 x 0.8 inches,0.50 Pounds,/parts/mopar-screw-hex-head~6034530.html
6,6035558,SCREW Hex Flange Head .375-16x1.50,,1992-2005,"COMP. Coupe, GTS Coupe, GTS-L Coupe, RT/10 Convertible, SRT-10 Convertible, SRT-10 Coupe","10 Cyl 8.0L, 10 Cyl 8.3L",9,1,,,,available,6.25,4.91,1.8 x 0.7 x 0.7 inches,0.90 Pounds,/parts/mopar-screw-hex-flange-head~6035558.html
